course_id,course_name,course_description,course_difficulty_level,course_duration_in_weeks
100,Commissioning editor Fundamentals,Loss give employee ball. Eye level popular apply see moment.,INTERMEDIATE,20
101,Neurosurgeon Fundamentals,She change picture. Produce owner voice if. Different leave third city.,EXPERT,4
9,MERN stack,"A MERN stack course covers the integration of four key technologies: MongoDB, Express.js, React, and Node.js. It teaches how to build full-stack web applications, from front-end user interfaces to back-end APIs and databases. The course focuses on developing scalable, dynamic web applications using JavaScript across the stack.",INTERMEDIATE,6
10,Reactjs,"A React.js course typically covers the fundamentals of building dynamic user interfaces using components, JSX, and state management. It introduces key concepts like props, hooks, and routing for creating responsive web applications. Advanced topics may include managing global state with tools like Redux, optimizing performance, and integrating with backend APIs.",BEGINNER,2
12,Machine Learning,"A machine learning (ML) learning path is a structured curriculum designed to guide learners through the various stages of mastering machine learning concepts and techniques. It typically includes foundational topics like statistics and programming, advanced topics such as neural networks and deep learning, and practical applications through hands-on projects. Following a learning path helps learners systematically build their skills and knowledge, ensuring they are well-prepared for real-world ML challenges.",EXPERT,6
102,"Merchandiser, retail Fundamentals",Change finish production realize president. Option customer understand act any.,BEGINNER,8
103,Arts development officer Fundamentals,Shoulder pressure subject notice determine sister ability professional.,INTERMEDIATE,12
104,"Embryologist, clinical Fundamentals",Interview huge agree. They wish analysis city.,BEGINNER,12
105,Marketing executive Fundamentals,Apply bring music institution certain spring.,INTERMEDIATE,8
106,Mechanical engineer Fundamentals,Business heart matter experience.,EXPERT,12
107,Occupational hygienist Fundamentals,Red true factor. Hot quality outside road each final key sing.,EXPERT,4
108,Arboriculturist Fundamentals,East dog Mrs summer factor remember yeah. Any budget wonder like reveal travel.,INTERMEDIATE,4
109,IT trainer Fundamentals,Training get security her American garden Democrat despite.,INTERMEDIATE,12
110,Site engineer Fundamentals,Yard experience support. Edge enter economic note over.,INTERMEDIATE,8
111,"Loss adjuster, chartered Fundamentals",Fund food art hold buy. Common politics level stand.,EXPERT,20
112,Exercise physiologist Fundamentals,Sometimes participant degree without style build notice.,EXPERT,16
113,Theatre stage manager Fundamentals,Few operation language statement defense. Able third draw child.,INTERMEDIATE,4
114,Travel agency manager Fundamentals,Upon authority reflect democratic. Guess too against pretty remain short heavy.,BEGINNER,16
115,Office manager Fundamentals,Since sing industry instead strong benefit. Society president name people.,BEGINNER,8
116,"Engineer, production Fundamentals",Student with floor dream. Accept current to light.,BEGINNER,4
117,Industrial buyer Fundamentals,Table shake charge the. And any just film. Every personal front.,BEGINNER,16
118,Research scientist (life sciences) Fundamentals,Suggest let wear real political. Clearly sea explain wait role.,INTERMEDIATE,24
119,Occupational hygienist Fundamentals,Program officer collection one vote individual middle.,BEGINNER,4
120,"Engineer, automotive Fundamentals",These policy until value show.,INTERMEDIATE,16
121,"Surveyor, building Fundamentals",Its mother stage tend window understand budget no. Consider art news region.,EXPERT,4
122,Television camera operator Fundamentals,Final exactly trial state himself economy. Spend effort relationship animal.,INTERMEDIATE,16
123,Paediatric nurse Fundamentals,Television worry information series. Son evidence agreement increase.,INTERMEDIATE,4
124,Armed forces training and education officer Fundamentals,Yes spend certainly beat out factor seven. Positive standard talk mention.,EXPERT,12
125,Metallurgist Fundamentals,Window PM enter check nothing hand always.,EXPERT,4
126,Chief Executive Officer Fundamentals,Development both wife. Half any six garden story.,EXPERT,16
127,Air broker Fundamentals,Attorney teacher red show.,INTERMEDIATE,4
128,Furniture designer Fundamentals,Fish science blood determine ago great phone. Enjoy top leave skin also change.,INTERMEDIATE,16
129,Diagnostic radiographer Fundamentals,Organization compare enjoy whatever company.,BEGINNER,24
130,Higher education lecturer Fundamentals,Particular beat watch attack some against outside.,EXPERT,20
131,Industrial/product designer Fundamentals,There may new edge mission.,EXPERT,24
132,IT trainer Fundamentals,Issue involve guy heart material child.,EXPERT,12
133,Occupational hygienist,Against peace simple what group medical.,INTERMEDIATE,8
134,Production manager Fundamentals,Morning paper responsibility. Network least again face program ten song.,EXPERT,24
135,Administrator Fundamentals,Way instead somebody place. The soon mouth example north.,INTERMEDIATE,20
136,Adult guidance worker Fundamentals,Know water push close. Produce picture no investment stop.,EXPERT,16
137,Podiatrist Fundamentals,Majority family everybody sign. Fall she color would arm pay risk.,BEGINNER,24
138,"Copywriter, advertising Fundamentals",About foreign course.,BEGINNER,20
139,"Engineer, site Fundamentals",Support type it car. Fall attention cut almost resource.,BEGINNER,20
140,Structural engineer Fundamentals,Project wear throughout hold know dinner.,EXPERT,4
141,Accommodation manager Fundamentals,Prevent six you country design including.,BEGINNER,8
142,Politician's assistant Fundamentals,After tonight thought allow may state five.,INTERMEDIATE,8
143,Waste management officer Fundamentals,Change firm office particular alone trial. Already adult on others.,EXPERT,24
144,"Designer, ceramics/pottery Fundamentals",Right doctor although. Decade million standard rather born.,BEGINNER,16
145,Barista Fundamentals,Head worker local better. Purpose feeling stand thousand policy theory none.,INTERMEDIATE,4
146,"Engineer, control and instrumentation Fundamentals",Apply up hour camera size. Forward agent as still production energy.,INTERMEDIATE,8
147,"Engineer, control and instrumentation Fundamentals",Tree strong cut page information wonder child. Very respond lay test learn.,EXPERT,24
148,Pathologist Fundamentals,Trade relate any wear important choose.,EXPERT,20
149,Insurance claims handler Fundamentals,Care consumer full consider ahead. Realize audience job against year catch.,BEGINNER,4
150,Music therapist Fundamentals,Eye could have generation agreement study. Plan member think.,INTERMEDIATE,8
151,Commercial horticulturist Fundamentals,Tree low fact huge explain wait above. Work check amount address.,BEGINNER,12
152,"Scientist, research (physical sciences) Fundamentals",Trial practice half. And clearly water resource measure.,EXPERT,16
153,Educational psychologist Fundamentals,She process main exactly sense development. Myself into sell administration.,INTERMEDIATE,12
154,Trading standards officer Fundamentals,Baby sing small goal reduce. Today design trial language choice activity.,INTERMEDIATE,4
155,"Education officer, community Fundamentals",Stuff water difference seem set. Son pattern Mrs direction fear official.,EXPERT,12
156,Animal technologist Fundamentals,Next today American price involve. Some threat buy born beautiful.,EXPERT,12
157,Site engineer Fundamentals,Just produce natural practice. Day exactly husband huge technology.,EXPERT,24
158,"Engineer, chemical Fundamentals",Level always fine gas take. Seek structure factor economy none.,INTERMEDIATE,20
159,Tourist information centre manager Fundamentals,Election foreign official forward. Door though assume end about type century.,INTERMEDIATE,20
160,"Scientist, biomedical Fundamentals",Live on ground natural page message.,EXPERT,16
161,Analytical chemist Fundamentals,Too to foreign similar policy realize floor. Newspaper if court leg election.,EXPERT,16
162,Senior tax professional/tax inspector Fundamentals,Matter hit society degree.,EXPERT,20
163,Ophthalmologist Fundamentals,Traditional several management. Prepare trouble environment some.,INTERMEDIATE,4
164,Education administrator Fundamentals,Family summer service. Just stand watch condition.,INTERMEDIATE,8
165,Electronics engineer Fundamentals,Institution both speak Democrat. Way Mr agency control.,BEGINNER,16
166,Chief Financial Officer Fundamentals,Author decision state recent strong age value. Cup western force garden.,INTERMEDIATE,20
167,"Psychologist, sport and exercise Fundamentals",Teacher others work phone agreement man eat.,INTERMEDIATE,24
168,"Scientist, clinical (histocompatibility and immunogenetics) Fundamentals",Technology radio laugh blue anyone general which.,INTERMEDIATE,20
169,Personnel officer Fundamentals,Still wish clear table positive wind coach. Class teach let.,INTERMEDIATE,16
170,Publishing copy Fundamentals,Allow conference future we eat goal finish.,EXPERT,4
171,Retail manager Fundamentals,Trade him thing former protect candidate.,BEGINNER,20
172,Immigration officer Fundamentals,Each start wear manage spring. Too evening money may indicate that.,EXPERT,12
173,Product manager Fundamentals,North class different base step area. Much someone reach every treatment.,EXPERT,4
174,"Librarian, public Fundamentals",From name heavy house relate though. Television present stage.,INTERMEDIATE,8
175,Clinical research associate Fundamentals,Include meet not remain. Decade nice decision political law join guy.,BEGINNER,4
176,Pharmacologist Fundamentals,Water poor discuss top director note American.,EXPERT,16
177,Homeopath Fundamentals,Manager just summer most. Television or environmental find.,INTERMEDIATE,4
178,Risk manager Fundamentals,World evidence include top region understand pattern.,INTERMEDIATE,12
179,Systems analyst Fundamentals,Discussion employee positive city front wish.,EXPERT,4
180,Geophysical data processor Fundamentals,Friend beautiful likely likely right off summer.,EXPERT,24
181,Furniture designer Fundamentals,Not those lawyer this account specific player. Become down save into.,EXPERT,8
182,"Engineer, mining Fundamentals",Approach couple represent save through. Us evening whatever.,INTERMEDIATE,24
183,Tax adviser Fundamentals,Live teach environment animal require then.,BEGINNER,20
184,Multimedia specialist Fundamentals,New capital professional open free clearly forget.,BEGINNER,16
185,Records manager Fundamentals,Maintain analysis building less maybe agree. Party simple account media.,BEGINNER,24
186,"Pilot, airline Fundamentals",Audience fear growth. Position above friend face toward truth four talk.,EXPERT,24
187,Energy engineer Fundamentals,Wear bring small teacher. Usually crime next. Idea current case friend.,EXPERT,12
188,"Research officer, trade union Fundamentals",Serve rock figure. Spring color step.,EXPERT,24
189,Youth worker Fundamentals,Media white likely modern agreement activity.,BEGINNER,8
190,Fashion designer Fundamentals,Through mean second fish do half organization.,INTERMEDIATE,24
191,Arts development officer Fundamentals,Once rule hour. Perhaps finish need over. Activity rich course room.,EXPERT,24
192,Planning and development surveyor Fundamentals,Fire your level these movie hard I blood. Water soldier girl body.,BEGINNER,12
193,"Editor, commissioning Fundamentals",From special low them cultural good.,BEGINNER,12
194,"Production assistant, television Fundamentals",Cup decision foreign want list deep. Believe plan north fall bed.,INTERMEDIATE,12
195,Automotive engineer Fundamentals,Full will century deal wrong leave. Seat glass value away.,EXPERT,12
196,Electrical engineer Fundamentals,Board section thought property window.,EXPERT,8
197,"Designer, graphic Fundamentals",White recently give agent military. Product wonder record theory author.,INTERMEDIATE,8
198,Aeronautical engineer Fundamentals,Only majority simple. Environmental large say finish.,INTERMEDIATE,24
199,"Nurse, adult Fundamentals",Possible sense face certain seem begin. Main reveal year rise.,INTERMEDIATE,16
